### ISSUE TITLE
Intermittent failure in kubernetes coredns 

### ISSUE THREAD

**Issue by shruthidharani-4313** [miekg/coredns#5347]
I have built a rancher cluster with multiple interfaces. And on the worker node, I could see the default route is eth0. Also I have installed a pod in the default namespace of rancher cluster. I have one container inside that pod and also I am getting eth0 as default route inside that container. With this route, my pod/container is able to communicate coredns without any issues. 
But I don't need to send all traffic via default eth0 interface. So I changed the default route as eth2 instead of eth0 on both worker node and inside my container. 
Once I changed the default route, container is getting intermittent failure to reach coredns. 

Could someone help me out why this issue is occurring when I change default route? I am not sure whether coredns communication will work only using eth0. Is there anything like that?

**Comment by sakulka** [comment]
hi, how is the cni deployed? i mean reachability condition,  if you are using calico or flannel, can you please share those details?

**Comment by shruthidharani-4313** [comment]
@sakulka After installing rancher cluster, I see calico and flannel interfaces in worker node. Below are the interface details.
```
[centos@dsc-worker-node-0-shruthim1 ~]$ netstat -i
Kernel Interface table
Iface             
cali0ea2f089216  
cali2e68bd7f2db 
cali32baa7f02a9  
cali3e3fc5cf06b  
cali6314f837688 
cali664ac89da34  
cali711517c32a8  
calicbf7f3f5323  
calid1b54b89132  
califeac733e094  
docker0          
eth0             
eth1            
eth2             
eth3             
flannel.1        
lo             
```
As I'm quite new to the rancher cluster and kubernetes environment, hope you asked about this.

**Comment by sakulka** [comment]
share this o/p kubectl get all -n kube-system, if kube-system name space is available, we will have to check how is the calico interface defined to reach the gateway for node to node communication.

**Comment by sakulka** [comment]
without updating the parameter in the reachability method for calico, by just changing the default interface on the linux box, would throw and error as the pod would not have any interface to connect to api or coredns on the compute/master node.

**Comment by shruthidharani-4313** [comment]
@sakulka Can you please share the name of the parameter need to update and How can we update that parameter? 
o/p of kubectl get all -n kube-system:
```
mshruthi@dev-vm34-shruthi:~/code/velocix/el7/master/helm-da$  kubectl get all -n kube-system
NAME                                           READY   STATUS      RESTARTS   AGE
pod/calico-kube-controllers-7fbff695b4-55jl9   1/1     Running     0          36h
pod/canal-5vj6t                                2/2     Running     0          23h
pod/canal-xrf8j                                2/2     Running     0          36h
pod/coredns-6f85d5fb88-k2m6c                   1/1     Running     0          86m
pod/coredns-autoscaler-79599b9dc6-wvjgq        1/1     Running     0          23h
pod/kube-multus-ds-tx76h                       1/1     Running     0          19h
pod/metrics-server-8449844bf-qg9zj             1/1     Running     0          23h
pod/rke-coredns-addon-deploy-job-5zq4d         0/1     Completed   0          36h
pod/rke-ingress-controller-deploy-job-rwxrw    0/1     Completed   0          36h
pod/rke-metrics-addon-deploy-job-jcnfn         0/1     Completed   0          36h
pod/rke-network-plugin-deploy-job-k9t4z        0/1     Completed   0          36h
pod/whereabouts-r746r                          1/1     Running     0          23h

NAME                     TYPE        CLUSTER-IP     EXTERNAL-IP   PORT(S)                  AGE
service/kube-dns         ClusterIP   10.43.0.10     <none>        53/UDP,53/TCP,9153/TCP   36h
service/metrics-server   ClusterIP   10.43.186.83   <none>        443/TCP                  36h

NAME                            DESIRED   CURRENT   READY   UP-TO-DATE   AVAILABLE   NODE SELECTOR            AGE
daemonset.apps/canal            2         2         2       2            2           kubernetes.io/os=linux   36h
daemonset.apps/kube-multus-ds   1         1         1       1            1           <none>                   19h
daemonset.apps/whereabouts      1         1         1       1            1           <none>                   26h

NAME                                      READY   UP-TO-DATE   AVAILABLE   AGE
deployment.apps/calico-kube-controllers   1/1     1            1           36h
deployment.apps/coredns                   1/1     1            1           36h
deployment.apps/coredns-autoscaler        1/1     1            1           36h
deployment.apps/metrics-server            1/1     1            1           36h

NAME                                                 DESIRED   CURRENT   READY   AGE
replicaset.apps/calico-kube-controllers-7fbff695b4   1         1         1       36h
replicaset.apps/coredns-6f85d5fb88                   1         1         1       36h
replicaset.apps/coredns-autoscaler-79599b9dc6        1         1         1       36h
replicaset.apps/metrics-server-8449844bf             1         1         1       36h

NAME                                          COMPLETIONS   DURATION   AGE
job.batch/rke-coredns-addon-deploy-job        1/1           7s         36h
job.batch/rke-ingress-controller-deploy-job   1/1           4s         36h
job.batch/rke-metrics-addon-deploy-job        1/1           5s         36h
job.batch/rke-network-plugin-deploy-job       1/1           5s         36h
```

**Comment by shruthidharani-4313** [comment]
@sakulka I have added an explicit route to reach kubernetes nameserver ip via eth0. 
```
route -n output:
[root@ac-0 cachelogic]# route -n
Kernel IP routing table
Destination     Gateway         Genmask         Flags Metric Ref    Use Iface
0.0.0.0         10.31.7.1       0.0.0.0         UG    0      0        0 net2
10.30.5.0       0.0.0.0         255.255.255.0   U     0      0        0 eth1
10.31.7.0       0.0.0.0         255.255.255.0   U     0      0        0 eth2
**10.43.0.0       169.254.1.1     255.255.0.0     UG    0      0        0 eth0**
169.254.1.1     0.0.0.0         255.255.255.255 UH    0      0        0 eth0
```
Here is the output of tcpdump from worker node :
```
worker-node:
--------------
container eth0 ip- 10.42.1.53, kubernetes nameserver ip - 10.43.0.10 and coredns pod ip - 10.42.1.52.
07:24:02.462870 IP 10.42.1.53.43254 > 10.43.0.10.domain: 45713+ A? da.default.svc.cluster.local. (46)
07:24:02.462918 IP 10.42.1.53.43254 > 10.42.1.52.domain: 45713+ A? da.default.svc.cluster.local. (46)
07:24:02.463175 IP 10.42.1.52.domain > 10.42.1.53.43254: 45713*- 1/0/0 A 10.43.192.146 (90)
```

but I got :no server could be reached inside container. 
```
[root@user]# host da
;; connection timed out; no servers could be reached
```

**Comment by sakulka** [comment]
kubectl edit ds -n kube-system kube-multus-ds, please check here for - name: IP_AUTODETECTION_METHOD, if its based on your interface, you will have to revert the configuration,,below is an example

[root@maas-master0 ~]# kubectl describe ds -n kube-system calico-node | grep -i AUTODETECTION
      IP_AUTODETECTION_METHOD:            can-reach=10.69.74.1
      IP6_AUTODETECTION_METHOD:           first-found
kubectl describe ds -n kube-system  kube-multus-ds | grep -i AUTODETECTION

**Comment by shruthidharani-4313** [comment]
@sakulka I couldn't see "AUTODETECTION" in kube-multus-ds. 
```
root@user$ kubectl describe ds kube-multus-ds -n kube-system
Name:           kube-multus-ds
Selector:       name=multus
Node-Selector:  <none>
Labels:         app=multus
                name=multus
                tier=node
Annotations:    deprecated.daemonset.template.generation: 1
Desired Number of Nodes Scheduled: 1
Current Number of Nodes Scheduled: 1
Number of Nodes Scheduled with Up-to-date Pods: 1
Number of Nodes Scheduled with Available Pods: 1
Number of Nodes Misscheduled: 0
Pods Status:  1 Running / 0 Waiting / 0 Succeeded / 0 Failed
Pod Template:
  Labels:           app=multus
                    name=multus
                    tier=node
  Service Account:  multus
  Containers:
   kube-multus:
    Image:      ghcr.io/k8snetworkplumbingwg/multus-cni:latest
    Port:       <none>
    Host Port:  <none>
    Command:
      /entrypoint.sh
    Args:
      --multus-conf-file=auto
      --cni-version=0.3.1
    Limits:
      cpu:     100m
      memory:  50Mi
    Requests:
      cpu:        100m
      memory:     50Mi
    Environment:  <none>
    Mounts:
      /host/etc/cni/net.d from cni (rw)
      /host/opt/cni/bin from cnibin (rw)
      /tmp/multus-conf from multus-cfg (rw)
  Volumes:
   cni:
    Type:          HostPath (bare host directory volume)
    Path:          /etc/cni/net.d
    HostPathType:
   cnibin:
    Type:          HostPath (bare host directory volume)
    Path:          /opt/cni/bin
    HostPathType:
   multus-cfg:
    Type:      ConfigMap (a volume populated by a ConfigMap)
    Name:      multus-cni-config
    Optional:  false
Events:        <none>
```

root@user~/usr$ kubectl describe ds -n kube-system kube-multus-ds | grep -i AUTODETECTION
root@user:~/usr$

**Comment by sakulka** [comment]
can you check the same replacing kube-multus-ds with canal?

**Comment by shruthidharani-4313** [comment]
@sakulka No, not present in canal as well.

```
root@user$ kubectl describe ds -n kube-system canal
Name:           canal
Selector:       k8s-app=canal
Node-Selector:  kubernetes.io/os=linux
Labels:         k8s-app=canal
Annotations:    deprecated.daemonset.template.generation: 1
Desired Number of Nodes Scheduled: 2
Current Number of Nodes Scheduled: 2
Number of Nodes Scheduled with Up-to-date Pods: 2
Number of Nodes Scheduled with Available Pods: 2
Number of Nodes Misscheduled: 0
Pods Status:  2 Running / 0 Waiting / 0 Succeeded / 0 Failed
Pod Template:
  Labels:           k8s-app=canal
  Service Account:  canal
  Init Containers:
   install-cni:
    Image:      rancher/calico-cni:v3.16.5
    Port:       <none>
    Host Port:  <none>
    Command:
      /opt/cni/bin/install
    Environment Variables from:
      kubernetes-services-endpoint  ConfigMap  Optional: true
    Environment:
      CNI_CONF_NAME:         10-canal.conflist
      CNI_NETWORK_CONFIG:    <set to the key 'cni_network_config' of config map 'canal-config'>  Optional: false
      KUBERNETES_NODE_NAME:   (v1:spec.nodeName)
      CNI_MTU:               <set to the key 'veth_mtu' of config map 'canal-config'>  Optional: false
      SLEEP:                 false
    Mounts:
      /host/etc/cni/net.d from cni-net-dir (rw)
      /host/opt/cni/bin from cni-bin-dir (rw)
   flexvol-driver:
    Image:        rancher/calico-pod2daemon-flexvol:v3.16.5
    Port:         <none>
    Host Port:    <none>
    Environment:  <none>
    Mounts:
      /host/driver from flexvol-driver-host (rw)
  Containers:
   calico-node:
    Image:      rancher/calico-node:v3.16.5
    Port:       <none>
    Host Port:  <none>
    Requests:
      cpu:      250m
    Liveness:   exec [/bin/calico-node -felix-live] delay=10s timeout=1s period=10s #success=1 #failure=6
    Readiness:  http-get http://localhost:9099/readiness delay=0s timeout=1s period=10s #success=1 #failure=3
    Environment Variables from:
      kubernetes-services-endpoint  ConfigMap  Optional: true
    Environment:
      DATASTORE_TYPE:                     kubernetes
      USE_POD_CIDR:                       true
      WAIT_FOR_DATASTORE:                 true
      NODENAME:                            (v1:spec.nodeName)
      CALICO_NETWORKING_BACKEND:          none
      CLUSTER_TYPE:                       k8s,canal
      FELIX_IPTABLESREFRESHINTERVAL:      60
      IP:
      CALICO_DISABLE_FILE_LOGGING:        true
      FELIX_DEFAULTENDPOINTTOHOSTACTION:  ACCEPT
      FELIX_IPV6SUPPORT:                  false
      FELIX_LOGFILEPATH:                  none
      FELIX_LOGSEVERITYSYS:
      FELIX_LOGSEVERITYSCREEN:            Warning
      FELIX_HEALTHENABLED:                true
      FELIX_IPTABLESBACKEND:              auto
    Mounts:
      /lib/modules from lib-modules (ro)
      /run/xtables.lock from xtables-lock (rw)
      /sys/fs/ from sysfs (rw)
      /var/lib/calico from var-lib-calico (rw)
      /var/run/calico from var-run-calico (rw)
      /var/run/nodeagent from policysync (rw)
   kube-flannel:
    Image:      rancher/coreos-flannel:v0.13.0-rancher1
    Port:       <none>
    Host Port:  <none>
    Command:
      /opt/bin/flanneld
      --ip-masq
      --kube-subnet-mgr
    Environment:
      POD_NAME:           (v1:metadata.name)
      POD_NAMESPACE:      (v1:metadata.namespace)
      FLANNELD_IFACE:    <set to the key 'canal_iface' of config map 'canal-config'>  Optional: false
      FLANNELD_IP_MASQ:  <set to the key 'masquerade' of config map 'canal-config'>   Optional: false
    Mounts:
      /etc/kube-flannel/ from flannel-cfg (rw)
      /run/xtables.lock from xtables-lock (rw)
  Volumes:
   lib-modules:
    Type:          HostPath (bare host directory volume)
    Path:          /lib/modules
    HostPathType:
   var-run-calico:
    Type:          HostPath (bare host directory volume)
    Path:          /var/run/calico
    HostPathType:
   var-lib-calico:
    Type:          HostPath (bare host directory volume)
    Path:          /var/lib/calico
    HostPathType:
   xtables-lock:
    Type:          HostPath (bare host directory volume)
    Path:          /run/xtables.lock
    HostPathType:  FileOrCreate
   sysfs:
    Type:          HostPath (bare host directory volume)
    Path:          /sys/fs/
    HostPathType:  DirectoryOrCreate
   flannel-cfg:
    Type:      ConfigMap (a volume populated by a ConfigMap)
    Name:      canal-config
    Optional:  false
   cni-bin-dir:
    Type:          HostPath (bare host directory volume)
    Path:          /opt/cni/bin
    HostPathType:
   cni-net-dir:
    Type:          HostPath (bare host directory volume)
    Path:          /etc/cni/net.d
    HostPathType:
   policysync:
    Type:          HostPath (bare host directory volume)
    Path:          /var/run/nodeagent
    HostPathType:  DirectoryOrCreate
   flexvol-driver-host:
    Type:               HostPath (bare host directory volume)
    Path:               /usr/libexec/kubernetes/kubelet-plugins/volume/exec/nodeagent~uds
    HostPathType:       DirectoryOrCreate
  Priority Class Name:  system-node-critical
Events:                 <none>
```

**Comment by shruthidharani-4313** [comment]
@sakulka But by changing this, won't it affect coredns pod where it has only one interface (eth0)? Also I believe coredns pod also use same calico configurations

**Comment by sakulka** [comment]
yes, thats the reason by changing default ethernet interface, pod will be failing to communicate to kube-api as the calico interface remains unchanged, however, the routing table shows a different default route. however, the point here is i'm failing to understand where is the ip detection happening in the daemon set of cni

**Comment by shruthidharani-4313** [comment]
@sakulka I am using calico node of version `rancher/calico-node:v3.16.5`. Is this because of this version?
Also Is this not possible to make coredns to container/pod communication via any other ethernet interface instead of eth0 because coredns pod doesn't have eth0? Or once we somehow brought in ip detection env variable and edited it to take my interface (eth2), will coredns pod work with calico having eth2 ip detection (where coredns doesn't have eth2 itself)?

**Comment by sakulka** [comment]
no the version looks fine, find out the interface which calico is using, we shouldnt be changing that interface post cluster deployment, unless you have a centrally controlled mechanism from where you can update these changes in the db so that these changes are persistent across reboots.

**Comment by shruthidharani-4313** [comment]
@sakulka Thanks for giving patient reply to all my queries. Considering the scenario, I have changed calico to use eth2 interface before cluster deployment as you suggested, will coredns pod work with calico using my interface (eth2) (where coredns doesn't have eth2 itself)?

**Comment by chrisohaver** [comment]
> I am not sure whether coredns communication will work only using eth0. Is there anything like that?

By default CoreDNS listens to all available addresses.  You can use the _bind_ plugin to bind only to a subset of available addresses/interfaces.  However, from the perspective of a container deployed as a Cluster IP Service in Kubernetes, only a virtual eth0 exists (unless you've got a specialized multi-interface CNI deployed).  And that eth0 is a virtual interface in the container;  It is not the same as the node's eth0.

> It would be really helpful if someone explain how does end-to-end container to coredns communication (via which interface) will happen when we place dns query.

CoreDNS is deployed as a Cluster IP Service, so it happens the normal way a container communicates to a Kubernetes Cluster IP Service. It's not something to unique to CoreDNS.

**Comment by shruthidharani-4313** [comment]
@chrisohaver Yes, I deployed with multi-interface cni. But at the moment I change default route within my container and in worker node to eth2 instead of eth0, I see this failure. Is this because of default route changed in worker node as well?

**Comment by chrisohaver** [comment]
> Yes, I deployed with multi-interface cni.

OK, IMO this forum isn't the best place for this question. The question would be better asked in the forums for that CNI.
