### ISSUE TITLE
How come some resolvers (1.1.1.1) can't resolve CNAME pointing to external domains ?

### ISSUE THREAD

**Issue by guillaumefenollar** [miekg/coredns#5104]
First thank you for that great project :) 
First of all, I'm puzzled I don't find anything related to that problem because it seems a frequent usage. I may be misusing CoreDNS or RFC 1035 files, in case I apology :) But I'm facing this issue in several environments.

I'm trying to use CoreDNS 1.8.6 (docker img) with file plugin and it can't resolve CNAME records when they return external domain names  ( ie current server is not authoritative), using some resolvers, like cloudflare and others (as stated on dnschecker.org for instance).

Here's a simple Corefile:
```
. {
  errors
  log
  reload 30s
  hebergement-web.nc {
     file db.hebergement-web.nc
  }
}
```
And the zone content : 
```
$TTL 86400
$ORIGIN hebergement-web.nc.
@      IN SOA dns.fenollar.fr. guillaume.fenollar.fr. (
                2022011901 ; serial 
                86400       ; refresh (2 hours)
                86400       ; retry (1 hour)
                1209600    ; expire (2 weeks)
                86400       ; minimum (1 hour)
                )

    86400 IN NS vps.fenollar.fr.
    86400 IN NS dns.fenollar.fr.

test IN CNAME novit.io.
```

Now a dig using Google resolver 
```
; <<>> DiG 9.16.23 <<>> test.hebergement-web.nc @8.8.8.8
;; global options: +cmd
;; Got answer:
;; ->>HEADER<<- opcode: QUERY, status: NOERROR, id: 31696
;; flags: qr rd ra; QUERY: 1, ANSWER: 2, AUTHORITY: 0, ADDITIONAL: 1

;; OPT PSEUDOSECTION:
; EDNS: version: 0, flags:; udp: 512
;; QUESTION SECTION:
;test.hebergement-web.nc.	IN	A

;; ANSWER SECTION:
test.hebergement-web.nc. 21600	IN	CNAME	novit.io.
novit.io.		3600	IN	A	164.132.97.235

;; Query time: 560 msec
;; SERVER: 8.8.8.8#53(8.8.8.8)
;; WHEN: Wed Jan 19 18:16:49 +11 2022
;; MSG SIZE  rcvd: 90
```
Next same request for 1.1.1.1
```
; <<>> DiG 9.16.23 <<>> test.hebergement-web.nc @1.1.1.1
;; global options: +cmd
;; Got answer:
;; ->>HEADER<<- opcode: QUERY, status: SERVFAIL, id: 11915
;; flags: qr rd ra; QUERY: 1, ANSWER: 0, AUTHORITY: 0, ADDITIONAL: 1

;; OPT PSEUDOSECTION:
; EDNS: version: 0, flags:; udp: 1232
; EDE: 22 (No Reachable Authority): (at delegation hebergement-web.nc.)
; EDE: 23 (Network Error): (139.99.217.72:53 rcode=SERVFAIL for test.hebergement-web.nc A)
;; QUESTION SECTION:
;test.hebergement-web.nc.	IN	A

;; Query time: 1660 msec
;; SERVER: 1.1.1.1#53(1.1.1.1)
;; WHEN: Wed Jan 19 18:17:18 +11 2022
;; MSG SIZE  rcvd: 158
```

And the according logs 
```
coredns-b49bs coredns [INFO] 172.69.47.71:12082 - 52702 "A IN novit.io. udp 37 true 1452" - - 0 0.002736558s
coredns-b49bs coredns [ERROR] plugin/errors: 2 novit.io. A: plugin/log: no next plugin found
```
I'm understanding that CoreDNS tries to resolve locally novit.io but is not authoritative so it gives up. Only workaround I found is to specify novit.io NS records by myself in the zone, which does not seems a good idea at scale :D 
Same result if I'm using forward plugin which I would not prefer to for that zone.

What am I doing wrong ? :)

**Comment by chrisohaver** [comment]
Assuming the example Corefile given is a typo (it’s invalid as is)…

For coredns to resolve a public name, it needs to be configured to forward queries it is not authoritative for to a public server, eg with the forward plugin.

```
. {
  errors
  log
  reload 30s
  file db.hebergement-web.nc hebergement-web.nc
  forward . 8.8.8.8
}
```

Or `forward . /etc/resolv.conf` On a Linux/Unix system, to use the hosts servers instead of hard coding them in the corefile.

**Comment by chrisohaver** [comment]
Reading this on a larger screen, I see I initally misunderstood what you have set up. Your aversion to adding forward makes sense now.

You have registered your zone with a name server running CoreDNS, and thus both 8.8.8.8 and 1.1.1.1 know about it and will recurse queries to it.

`8.8.8.8` sees the missing A record in the response and looks it up, adding it to the response, but `1.1.1.1` panics.

I'm not sure what's specifically at play here.  Perhaps captures of the DNS requests to CoreDNS could help (to identify differences in the requests if any).

**Comment by chrisohaver** [comment]
The extended error "No Reachable Authority" implies that CoreDNS did not respond to the request, or that the request never reached CoreDNS.

Perhaps the CoreDNS logs presented actually correspond to a request from a different server, and CoreDNS never received the request from 1.1.1.1. Possibly because the CoreDNS server is rejecting requests from 1.1.1.1, or the CoreDNS server is otherwise unreachable from 1.1.1.1 (e.g. rejected by some intermediate hop).

**Comment by guillaumefenollar** [comment]
Hello @chrisohaver and thanks for your interest in this issue.
You're right the Corefile here is invalid, the zone block shouldn't be included in root. In my env it's properly reloaded :) 
Anyway, she logs shown are really the one corresponding to the preceding request for 1.1.1.1, it's appearing realtime in the logs and if there wasn't any cache on cloudflare's side, I could do it hundreds of time and have the same result in the logs (I don't have any other request coming to that server in the same minute I'm making this test), so I'm pretty sure coredns is getting the request properly. Also, I can reproduce this issue in two different infrastructures, one of these have complete access to the Internet with only iptables that I believe I handled well.

Result with SERVFAIL is the same if I query the CoreDNS server directly for this same record , which I believe is normal since I haven't enabled forward.
```
; <<>> DiG 9.16.23 <<>> test.hebergement-web.nc @dns.fenollar.fr
;; global options: +cmd
;; Got answer:
;; ->>HEADER<<- opcode: QUERY, status: SERVFAIL, id: 35837
;; flags: qr aa rd; QUERY: 1, ANSWER: 1, AUTHORITY: 2, ADDITIONAL: 1
;; WARNING: recursion requested but not available

;; OPT PSEUDOSECTION:
; EDNS: version: 0, flags:; udp: 4096
; COOKIE: 7cced21c24678d80 (echoed)
;; QUESTION SECTION:
;test.hebergement-web.nc.	IN	A

;; ANSWER SECTION:
test.hebergement-web.nc. 86400	IN	CNAME	novit.io.

;; AUTHORITY SECTION:
hebergement-web.nc.	86400	IN	NS	vps.fenollar.fr.
hebergement-web.nc.	86400	IN	NS	dns.fenollar.fr.

;; Query time: 20 msec
;; SERVER: 139.99.220.229#53(139.99.220.229)
;; WHEN: Thu Jan 20 08:00:29 +11 2022
;; MSG SIZE  rcvd: 203
```
And corresponding logs :
```
coredns-b49bs coredns [INFO] 115.126.186.202:45748 - 60610 "A IN novit.io. udp 49 false 4096" - - 0 0.000106636s
coredns-b49bs coredns [ERROR] plugin/errors: 2 novit.io. A: plugin/log: no next plugin found
```
Corresponding tcpdump capture for this same request (@dns.fenollar.fr)
```
21:04:55.644371 IP 115.126.186.202.33346 > 139.99.217.72.53: 61360+ [1au] A? test.hebergement-web.nc. (64)
21:04:55.645739 IP 139.99.217.72.53 > 115.126.186.202.33346: 61360 ServFail*- 1/2/1 CNAME novit.io. (203)
```

And the capture while using 1.1.1.1
```
21:12:50.774613 IP 172.69.47.71.33681 > 139.99.220.229.53: 17323 [1au] A? test.hebergement-web.nc. (52)
21:12:50.775443 IP 139.99.220.229.53 > 172.69.47.71.33681: 17323 ServFail*- 1/2/1 CNAME novit.io. (191)
21:12:50.941741 IP6 2400:cb00:208:1024::ac45:2f47.28236 > 2402:1f00:8102:100::568.53: 17323 [1au] A? test.hebergement-web.nc. (52)
21:12:51.442252 IP 172.69.47.71.44665 > 139.99.220.229.53: 17323 [1au] A? test.hebergement-web.nc. (52)
21:12:51.443137 IP 139.99.220.229.53 > 172.69.47.71.44665: 17323 ServFail*- 1/2/1 CNAME novit.io. (191)
```
We see here that 1.1.1.1 tries querying twice (8.8.8.8 does too), but also tried ipv6 but I don't see the answer. It's a cloud machine only running iptables and port 53 is opened udp/tcp on both directions for ipv4 and ipv6 so no filtering here. If coredns is not responding to ipv6, can it explain my issue ? 8.8.8.8 appears not to be trying any ipv6 request : 
```
21:19:50.272338 IP 172.217.33.1.52261 > 139.99.217.72.53: 38856% [1au] A? test.hebergement-web.nc. (52)
21:19:50.273387 IP 139.99.217.72.53 > 172.217.33.1.52261: 38856 ServFail*- 1/2/1 CNAME novit.io. (191)
21:19:50.274758 IP 172.253.204.5.49387 > 139.99.217.72.53: 43171% A? test.hebergement-web.nc. (41)
21:19:50.275548 IP 139.99.217.72.53 > 172.253.204.5.49387: 43171 ServFail*- 1/2/0 CNAME novit.io. (180)
```

**Comment by chrisohaver** [comment]
> If coredns is not responding to ipv6, can it explain my issue?

I'm not sure how 1.1.1.1 handles non-responses.
CoreDNS by default listens to all available interfaces, so if the ipv6 request gets routed to CoreDNS, it would answer.

There _is_ a difference in the request coming in... 8.8.8.8 sets RD (the + symbol after the query ID). 1.1.1.1 does not.

The response seems to be the same in either case, but maybe could affect how the response is interpreted. Thinking out loud here ...
* Since 8.8.8.8 sets RD, perhaps it interprets the SERVFAIL as a failed recursion - i.e. that it should continue the recursion itself.
* 1.1.1.1 doesn't set RD, presumably it already plans to do the recursion itself. So perhaps the SERVFAIL response is interpreted as a completely failed request, disregarding the content of the answer.

**Comment by maitredede** [comment]
Hi @chrisohaver ,
I have a question relative to `forward` configuration. Its purpose is to resolve request with an other server if requested domain is not found. In this case, if we put it, does it mean that coredns will forward any requests (for unknown domain) to other server ? For example, will it forward the request to configured server if I ask it to resolve `unknowndomain.io` ? Like an open DNS proxy...
I think the wanted behavior is only to forward when resolution needs it (like responding with a non-authoritative CNAME in this case), or to serve response with CNAME entry, but not trying to do recursion. So it does not SERVFAIL.

**Comment by chrisohaver** [comment]
> does it mean that coredns will forward any requests (for unknown domain) to other server ?

yes

**Comment by chrisohaver** [comment]
> does it mean that coredns will forward any requests (for unknown domain) to other server ? 

yes

> I think the wanted behavior is only to forward when resolution needs...

I realized that forward was not the appropriate solution [earlier](https://github.com/coredns/coredns/issues/5104#issuecomment-1016688500), hence my followup comments regarding RD and non-RD requests.

To elaborate on [that line of thinking](https://github.com/coredns/coredns/issues/5104#issuecomment-1018808370), I'm wondering if CoreDNS should not return SERVFAIL when CNAME target lookups fail. I think SERVFAIL is a correct response in this case for a recursive server being asked to recurse, but CoreDNS isn't recursive.  It seems that 8.8.8.8 should also be failing here, since the reply lacks the RA flag, but perhaps it tolerates the mismatch answer/rcode.

**Comment by chrisohaver** [comment]
I think I broke this with #4863 - specifically the deceptively intuitive part that changes the response code when an external lookup returns an error, from NOERROR to SERVFAIL.  In this case (this issue), the error is a "no next plugin found error".

I'll experiment to get an idea of the repercussions of reverting that part. IIRC, it wasn't core to the issue the PR fixed.

**Comment by guillaumefenollar** [comment]
I'm pretty sure it's a recent behavior because it's very first time this conf have so much repercussions. And talking about the criticity, it's not only about Cloudflare, but a lot of DNS servers , see by yourself : https://dnschecker.org/#A/test.hebergement-web.nc
Thank you for the help

**Comment by chrisohaver** [comment]
With #5120 closed,  I guess the question becomes "should CoreDNS be trying to resolve CNAME targets if has no means of resolving the target's zone." 

IOW, should CoreDNS just return the CNAME with a NOERROR if it is not authoritative for the CNAME's target zone, and does not forward upstream for that zone.

I think this is hard to ascertain before doing a lookup, but could imprecisely be inferred from certain error types or error codes of an attempted lookup.  e.g. REFUSED because coredns does not have a server listing to the zone.  Or error = "no next plugin" for when a server block handles a zone, but has no plugins that do.

**Comment by chrisohaver** [comment]
@guillaumefenollar,

Does the following corefile change behavior?

```
 hebergement-web.nc {
  errors
  log
  reload 30s
  file db.hebergement-web.nc
}
```

 I think it should prevent [the error case in the CNAME lookup](https://github.com/coredns/coredns/blob/482a20afce4b45af0736d04e74701051ec3146dd/plugin/file/lookup.go#L383-L387) - receiving a [REFUSED](https://github.com/coredns/coredns/blob/482a20afce4b45af0736d04e74701051ec3146dd/core/dnsserver/server.go#L287-L288) from the self lookup, and relaying that to the client.  Though - I don't know how a recursive resolver will handle the REFUSED error code.

**Comment by guillaumefenollar** [comment]
Same issue :(
```
coredns-b49bs coredns [INFO] 172.69.47.71:18528 - 30495 "A IN novit.io. udp 37 true 1452" - - 0 0.000035149s
coredns-b49bs coredns [ERROR] plugin/errors: 2 novit.io. A: plugin/forward: no next plugin found
coredns-b49bs coredns [INFO] 172.69.47.71:18528 - 30495 "A IN test.hebergement-web.nc. udp 52 true 1452" SERVFAIL qr,aa 180 0.00033994s
coredns-rvdlz coredns [INFO] 172.69.47.71:64780 - 30495 "A IN novit.io. udp 37 true 1452" - - 0 0.000046321s
coredns-rvdlz coredns [ERROR] plugin/errors: 2 novit.io. A: plugin/forward: no next plugin found
coredns-rvdlz coredns [INFO] 172.69.47.71:64780 - 30495 "A IN test.hebergement-web.nc. udp 52 true 1452" SERVFAIL qr,aa 180 0.000462327s
coredns-b49bs coredns [INFO] 172.69.47.71:24889 - 48496 "DNSKEY IN hebergement-web.nc. udp 47 true 1452" NOERROR qr,aa 126 0.000208166s
```
```
 <<>> DiG 9.16.25 <<>> test.hebergement-web.nc @1.1.1.1
;; global options: +cmd
;; Got answer:
;; ->>HEADER<<- opcode: QUERY, status: SERVFAIL, id: 10316
;; flags: qr rd ra; QUERY: 1, ANSWER: 0, AUTHORITY: 0, ADDITIONAL: 1

;; OPT PSEUDOSECTION:
; EDNS: version: 0, flags:; udp: 1232
; EDE: 22 (No Reachable Authority): (at delegation hebergement-web.nc.)
; EDE: 23 (Network Error): (139.99.217.72:53 rcode=SERVFAIL for test.hebergement-web.nc A)
;; QUESTION SECTION:
;test.hebergement-web.nc.	IN	A
```

Does anybody else can reproduce this error ? I have it on several clusters, so I'm a bit surprised I'm the only one reporting it

**Comment by chrisohaver** [comment]
> coredns-b49bs coredns [ERROR] plugin/errors: 2 novit.io. A: plugin/forward: no next plugin found

It still generated "no next plugin found", which is surprising.  I would have expected it to return REFUSED, because the Corefile _only_ handles `hebergement-web.nc `.

**Comment by guillaumefenollar** [comment]
The Corefile also handles other zones, but written the exact same way 
```
 hebergement-web.nc {
  errors
  log
  reload 30s
  file db.hebergement-web.nc
}
 xxxx {
  errors
  log
  reload 30s
  file xxxx
}
 yyy {
  errors
  log
  reload 30s
  file yyyy
}
(...)
```
For experementing, I deployed another coredns pod with only this configuration (This corefile and that zone only - hebergement-web.nc). Result is almost the same, it ends at the last plugin it finds in the configuration : 

```
coredns-bs26h coredns [INFO] 10.42.3.1:41571 - 812 "A IN novit.io. udp 49 false 4096" - - 0 0.000024178s
coredns-bs26h coredns [ERROR] plugin/errors: 2 novit.io. A: plugin/log: no next plugin found
coredns-bs26h coredns [INFO] 10.42.3.1:41571 - 812 "A IN test.hebergement-web.nc. udp 64 false 4096" SERVFAIL qr,aa,rd 180 0.00072737s
```
On dig side, result is exactly the same as https://github.com/coredns/coredns/issues/5104#issuecomment-1016879019

**Comment by chrisohaver** [comment]
Can you try the following single block pattern? The intent being to trap all unhandled zones and return NOERROR with the template plugin. 

```
. {
  errors
  log
  reload 30s

  file db.hebergement-web.nc hebergement-web.nc

  file db.xyz xyz

  template IN ANY
}
```

**Comment by guillaumefenollar** [comment]
It returns NOERROR but no answer... On every query regarding the zones before "template" plugin ! You can try on domain hebergement-web.nc by yourself at the moment, it's all about empty responses, no authority either
```
; <<>> DiG 9.16.22-Debian <<>> hebergement-web.nc
;; global options: +cmd
;; Got answer:
;; ->>HEADER<<- opcode: QUERY, status: NOERROR, id: 29278
;; flags: qr rd ra; QUERY: 1, ANSWER: 0, AUTHORITY: 0, ADDITIONAL: 1

;; OPT PSEUDOSECTION:
; EDNS: version: 0, flags:; udp: 1232
;; QUESTION SECTION:
;hebergement-web.nc.            IN      A
```
```
coredns-b49bs coredns [INFO] Reloading
coredns-b49bs coredns [INFO] plugin/reload: Running configuration MD5 = bcbdf7f16c506640706ae7b7b18118d4
coredns-b49bs coredns [INFO] Reloading complete
coredns-b49bs coredns [INFO] 139.99.221.138:50336 - 42125 "A IN hebergement-web.nc. udp 59 false 4096" NOERROR qr,aa,rd 36 0.008574197s
coredns-b49bs coredns [INFO] 139.99.221.138:50082 - 8506 "A IN hebergement-web.nc. udp 59 false 4096" NOERROR qr,aa,rd 36 0.000180848s
```
EDIT : if you wonder what zone content I'm having, here it is : 
```
$TTL 86400
$ORIGIN hebergement-web.nc.
@      IN SOA dns.fenollar.fr. guillaume.fenollar.fr. (
                2022011901 ; serial 
                86400       ; refresh (2 hours)
                86400       ; retry (1 hour)
                1209600    ; expire (2 weeks)
                86400       ; minimum (1 hour)
                )
                
    86400 IN NS dns.fenollar.fr.

    600 IN MX 10 mail.hebergement-web.nc.
mail    IN CNAME kube.fenollar.fr.
smtp    IN CNAME kube.fenollar.fr.

@       IN A 139.99.220.229
@       IN A 139.99.217.72

test IN CNAME novit.io.
*       IN CNAME kube.fenollar.fr.
```
EDIT2: I had to rollback Corefile configuration because I just realized one of my clients is using this hebergement-web.nc zone and I can't change whois, but it's easily reproducible if needed

**Comment by mschilt** [comment]
same issue here.. This happens reliably when I add a CNAME to my domain that points to a foreign domain name. The query fist gests answered correctly but the status will be SERVFAIL.
A CNAME to the same zone works correctly. (status = NOERROR)

**Comment by mschilt** [comment]
for the record: 
Adding
`        forward . 9.9.9.9`
to the config solves this issue .. BUT turns my server into an open resolver. 
The DNS answer now has the CNAME target resolved in the answer.

**Comment by maitredede** [comment]
Hi,
Also for the record, my actual version is `1.8.6`.
The only workarounds I found so far are :
- add `forward . x.x.x.x`, but like @mschilt stated, it turns to an open DNS (that is what I don't want)
- add NS entries of target domain (that is IMHO a very bad behavior)

I think coredns may either do the cname lookup recursion, send response as-is (without error), or respond with the correct "recursion refused" message.

**Comment by chrisohaver** [comment]
It's on my to-do list to register a domain and experiment with this to see if I can work out precisely why this occurs, and exactly how CoreDNS can respond such that all recursive resolvers will continue recursing.

**Comment by chrisohaver** [comment]
FWIW, I set up a local BIND9 instance to play with this, delegating a subdomain to a CoreDNS instance running just _file_ without a _forward_.  i.e.

* BIND defines zone `local.` and delegates `foo.local.` to CoreDNS
* BIND defines zone `other.` that contains an A record `test.other.`
* CoreDNS defines zone `foo.local.` with a CNAME `cname.foo.local.` that targets `test.other.`

I tested a few different CoreDNS configs, such that it would return either NOERROR or a SERVFAIL for `cname.foo.local.`.
In all cases, BIND includes the CNAME's target A record in the response as expected. That's unfortunate from a troubleshooting perspective, since I was hoping to replicate the issue seen by some other resolvers e.g. Cloudflare.

So, although _per BIND_ CoreDNS is behaving in an acceptable way, some other implementations do not think so.

**Comment by chrisohaver** [comment]
> I tested a few different CoreDNS configs, such that it would return either NOERROR or a SERVFAIL for cname.foo.local..
In all cases, BIND includes the CNAME's target A record in the response as expected.

I was wrong here.  I was confusing myself with too long TTLs and cache.  The good answer was cached, making other attempts appear successful.  After making TTLs very short, I was able to show that for BIND9:
* a NOERROR response code from CoreDNS results in BIND successfully returning a complete answer to the resolver
* a SERVFAIL response code from CoreDNS results in BIND returning a SERVFAIL to the resolver

IOW, the following Corefile works:

```
foo.local. {
  file foo.local.db
}
```

And the following Corefile does not work: 

```
. {
  file foo.local.db foo.local.
}
```

The working Corefile style is what I had suggested to try earlier (https://github.com/coredns/coredns/issues/5104#issuecomment-1021360938).  @guillaumefenollar, I wonder if when you tried it, perhaps the negative answer resulting from the previous Corefile was still cached by some recursive servers.

**Comment by mschilt** [comment]
Thank you for testing. 
Can confirm. after removing the 
```
. {
 # .. 
}
```
entry from the config file everything works as intended. (-> cname.foo.local resolves to foo.test.other with NOERROR)

**Comment by guillaumefenollar** [comment]
> The working Corefile style is what I had suggested to try earlier ([#5104 (comment)](https://github.com/coredns/coredns/issues/5104#issuecomment-1021360938)). @guillaumefenollar, I wonder if when you tried it, perhaps the negative answer resulting from the previous Corefile was still cached by some recursive servers.

Hello @chrisohaver 
Yes I have tried again with this configuration and it works. Last time I tried and it didn't work as expected [#5104 (comment)](https://github.com/coredns/coredns/issues/5104#issuecomment-1021360938), I did try in fact this configuration 

```
# NOT WORKING
. {
  errors
  log
  reload 30s
  health
}

hebergement-web.nc {
  file db.hebergement-web.nc
}
```
Although as you stated, this works :
```
# OK
hebergement-web.nc {
  errors
  log
  reload 30s
  health
  file db.hebergement-web.nc
}
```

Only issue about this configuration is that I have to repeat all common configuration (errors, log, reload...) for every domain covered by my Corefile, but I'm happy already to have a workaround :)

Thanks for your work !

**Comment by chrisohaver** [comment]
@guillaumefenollar ,

You can use a snippet to shorten your config. e.g.

```
(common) {
  errors
  log
  reload 30s
  health
}

hebergement-web.nc {
  import common
  file db.hebergement-web.nc
}

example.com {
  import common
  file db.example.com
}

```

FYI, regarding the way you tried before: When you add a root `.` block, CoreDNS creates a server to handle `.`. But if there are no other blocks that handle a given query, and the `.` block doesn't contain any plugins that provide an answer for the query, the result will be a SERVFAIL.  This is also the case for the original single block configuration.

The reason the working config works, is that it doesn't create any "dead-ends". Specifically, there are no serverblocks that encompass zones it cannot answer.

**Comment by endreszabo** [comment]
> IOW, should CoreDNS just return the CNAME with a NOERROR if it is not authoritative for the CNAME's target zone, and does not forward upstream for that zone.

I've seen nameservers returning with NXDOMAIN in this case.
