### ISSUE TITLE
[fixed with workaround] Doesn't work on Solaris

### ISSUE THREAD

**Issue by skeletorgithub** [miekg/coredns#6971]
**What happened**:

Doesn't work on Solaris: there isn't any response packet to client

**What you expected to happen**:

Response packet to client

**How to reproduce it (as minimally and precisely as possible)**:

Build on default settings on Oracle Solaris 11.4 and run with minimal configuration:

> .:53 {
>     forward . 192.168.56.19 192.168.56.21
>     log
>     errors
> }
> 

**Anything else we need to know?**:

Below tcpdump output from Linux and Solaris to compare

client = 192.168.56.159
coredns_linux = 192.168.56.106
coredns_solaris = 192.168.56.97
authoritative server of zone "dorado" = 192.168.56.19

- under Linux (ip=192.168.56.106)

> 10:55:11.910274 IP 192.168.56.159.52543 > 192.168.56.106.53: 4586+ [1au] A? qqq.dorado. (47)
> 10:55:11.910835 IP 192.168.56.106.48073 > 192.168.56.19.53: 13881+ [1au] A? qqq.dorado. (47)
> 10:55:11.912774 IP 192.168.56.19.53 > 192.168.56.106.48073: 13881 1/0/1 A 192.168.56.78 (51)
> 10:55:11.913019 IP 192.168.56.106.53 > 192.168.56.159.52543: 4586 1/0/1 A 192.168.56.78 (57)

- under Solaris (ip=192.168.56.97):

> 10:57:12.140341 IP 192.168.56.159.63826 > 192.168.56.97.53: 42426+ [1au] A? qqq.dorado. (47)
> 10:57:12.141544 IP 192.168.56.97.61031 > 192.168.56.19.53: 10068+ [1au] A? qqq.dorado. (47)
> 10:57:12.141923 IP 192.168.56.19.53 > 192.168.56.97.61031: 10068 1/0/1 A 192.168.56.78 (51)

So, there isn't any response packet (192.168.56.106.53 > 192.168.56.159) to client (ip=192.168.56.159) under Solaris. All dumps gather local with disabled firewall.

**Environment**:

- the version of CoreDNS: 1.11.4 + go1.23.2 (also tried on 1.11.3 + go1.21.8)
- Corefile:
- logs, if applicable:
- OS (e.g: `cat /etc/os-release`): Oracle Solaris 11.4
- Others:

**Comment by johnbelamaric** [comment]
I doubt any maintainers have access to Solaris to try this (honestly I didn't know it still existed), so you may need to work it out on your own...

**Comment by skeletorgithub** [comment]
It's Solaris related issue, and fixed by adding to config listen IP:
`bind 192.168.56.97`
So,
the result config must be
```
.:53 {
bind 192.168.56.97
forward . 192.168.56.19 192.168.56.21
log
errors
}
```
